id,slug,text,perimeter,group_id,group_name
15-commission-europeenne,commission-europeenne,Commission européenne,France,73.0,Commission européenne
22-ademe,ademe,ADEME,France,48.0,ADEME - GENERIQUE
25-mission-interministerielle-pour-la-qualite-des-con,mission-interministerielle-pour-la-qualite-des-con,Mission interministérielle pour la qualité des constructions publiques (MIQCP),France,75.0,Direction / délégation / mission  interministérielle et Secrétariat général
26-ministeres-de-lamenagement-du-territoire-et-de-la-transition-ecologique,ministeres-de-lamenagement-du-territoire-et-de-la-transition-ecologique,Ministères de l'Aménagement du territoire et de la Transition écologique,France,102.0,Ministère de la Transition Ecologique (MTE)
27-office-francais-de-la-biodiversite-ofb,office-francais-de-la-biodiversite-ofb,Office Français de la Biodiversité (OFB),France,117.0,Office français de la biodiversité (OFB)
33-dreets,dreets,"Directions régionales de l’économie, de l’emploi, du travail et des solidarités (DREETS)",,80.0,"Directions régionales de l’Economie, de l’Emploi, du Travail et des Solidarités (DREETS) - GENERIQUE"
40-region-ile-de-france,region-ile-de-france,Conseil régional d'Ile de France,Île-de-France,2.0,Conseil régional (CR)
46-ministere-des-outre-mer,ministere-des-outre-mer,Ministère des Outre-mer,Outre-mer,104.0,Ministère des Outre-mer
47-centre-national-pour-le-developpement-du-sport,centre-national-pour-le-developpement-du-sport,Centre National pour le Développement du Sport,,46.0,Établissement public national (autre)
48-agence-francaise-de-developpement,agence-francaise-de-developpement,Agence Française de Développement (AFD),France,46.0,Établissement public national (autre)
51-dgcl,dgcl,Direction générale des collectivités locales (DGCL),France,98.0,Ministère de la Cohésion des Territoires et des Relations avec les Collectivités Territoriales (MCTRCT)
53-agence-de-leau-rhone-mediterranee-corse,agence-de-leau-rhone-mediterranee-corse,Agence de l'eau Rhône-Méditerranée-Corse,Rhône-Méditerranée-Corse (Bassin hydrographique),19.0,Agence de l'eau
54-collectivite-de-corse,collectivite-de-corse,Collectivité de Corse,Corse,4.0,EPCI (hors métropoles) OU Établissement public territorial (EPT)
58-cerema,cerema,Cerema,France,66.0,CEREMA
61-mairie-de-saint-laurent,mairie-de-saint-laurent,Mairie de Saint-Laurent,,,
62-mairie-dawala-yalimapo,mairie-dawala-yalimapo,Mairie d'Awala-Yalimapo,,,
63-mairie-de-regina-kwa,mairie-de-regina-kwa,Mairie de Régina-Kwa,,,
64-mairie-de-cayenne,mairie-de-cayenne,Mairie de Cayenne,,,
67-office-du-developpement-agricole-et-rural-de-corse,office-du-developpement-agricole-et-rural-de-corse,Office du Développement Agricole et Rural de Corse (ODARC),Corse,46.0,Établissement public national (autre)
68-agence-nationale-de-lhabitat-anah,agence-nationale-de-lhabitat-anah,Agence Nationale de l'Habitat (ANAH),,86.0,Agence Nationale de l'Habitat (ANAH)
69-collectivite-territoriale-de-guyane,collectivite-territoriale-de-guyane,Collectivité Territoriale de Guyane,Guyane,4.0,EPCI (hors métropoles) OU Établissement public territorial (EPT)
70-mairie-de-mana,mairie-de-mana,Mairie de Mana,,,
71-mairie-de-papaichton,mairie-de-papaichton,Mairie de  Papaïchton,,,
72-mairie-de-sinnamary,mairie-de-sinnamary,Mairie de Sinnamary,,,
73-region-auvergne-rhone-alpes,region-auvergne-rhone-alpes,Conseil régional d'Auvergne-Rhône-Alpes,Auvergne-Rhône-Alpes,2.0,Conseil régional (CR)
74-agence-de-leau-loire-bretagne,agence-de-leau-loire-bretagne,Agence de l'Eau Loire-Bretagne,Loire-Bretagne,19.0,Agence de l'eau
75-ministere-de-lagriculture-et-de-lalimentation,ministere-de-lagriculture-et-de-lalimentation,Ministère de l'Agriculture et de la Souveraineté alimentaire,France,93.0,Ministère de l'Agriculture et de la Souveraineté alimentaire
76-ministere-des-solidarites-et-de-la-sante,ministere-des-solidarites-et-de-la-sante,Ministère de la Santé et de la Prévention,France,105.0,Ministère de la Santé et de la Prévention
79-grdf,grdf,GRDF,France,111.0,Entreprise
81-agence-de-leau-seine-normandie,agence-de-leau-seine-normandie,Agence de l'eau Seine Normandie,Seine-Normandie,19.0,Agence de l'eau
83-region-bretagne,region-bretagne,Conseil régional de Bretagne,Bretagne,2.0,Conseil régional (CR)
84-region-bourgogne-franche-comte,region-bourgogne-franche-comte,Conseil régional de Bourgogne-Franche-Comté,Bourgogne-Franche-Comté,2.0,Conseil régional (CR)
85-region-centre-val-de-loire,region-centre-val-de-loire,Conseil régional du Centre-Val de Loire,Centre-Val de Loire,2.0,Conseil régional (CR)
87-region-grand-est,region-grand-est,Conseil régional du Grand Est,Grand Est,2.0,Conseil régional (CR)
88-region-hauts-de-france,region-hauts-de-france,Conseil régional des Hauts-de-France,Hauts-de-France,2.0,Conseil régional (CR)
89-region-normandie,region-normandie,Conseil régional de Normandie,Normandie,2.0,Conseil régional (CR)
90-region-nouvelle-aquitaine,region-nouvelle-aquitaine,Conseil régional de Nouvelle-Aquitaine,Nouvelle-Aquitaine,2.0,Conseil régional (CR)
91-region-occitanie,region-occitanie,Conseil régional d'Occitanie,Occitanie,2.0,Conseil régional (CR)
92-region-pays-de-la-loire,region-pays-de-la-loire,Conseil régional des Pays de la Loire,Pays de la Loire,2.0,Conseil régional (CR)
93-region-provence-alpes-cote-dazur,region-provence-alpes-cote-dazur,Conseil régional de Provence-Alpes-Côte d'Azur,Provence-Alpes-Côte d'Azur,2.0,Conseil régional (CR)
96-ministere-de-la-culture,ministere-de-la-culture,Ministère de la Culture,France,99.0,Ministère de la Culture
98-ministere-de-leconomie-et-des-finances,ministere-de-leconomie-et-des-finances,"Ministère de l'Économie, des Finances et de la Souveraineté industrielle et numérique",France,94.0,"Ministère de l'Économie, des Finances et de la Souveraineté industrielle et numérique"
99-ministere-de-linterieur,ministere-de-linterieur,Ministère de l'Intérieur,France,118.0,Ministère de l'intérieur
100-ministere-de-leurope-et-des-affaires-etrangeres,ministere-de-leurope-et-des-affaires-etrangeres,Ministère de l'Europe et des Affaires étrangères,France,97.0,Ministère de l'Europe et des Affaires étrangères
101-ministere-de-la-justice,ministere-de-la-justice,Ministère de la Justice,France,143.0,Ministère de la justice
102-ministere-du-travail,ministere-du-travail,"Ministère du Travail, du Plein emploi et de l'Insertion",France,106.0,"Ministère du Travail, du Plein emploi et de l'Insertion"
103-ministere-de-leducation-nationale-et-de-la-jeuness,ministere-de-leducation-nationale-et-de-la-jeuness,Ministère de l'Éducation nationale et de la Jeunesse,France,95.0,Ministère de l'Éducation nationale et de la Jeunesse
104-ministere-de-lenseignement-superieur-de-la-recherc,ministere-de-lenseignement-superieur-de-la-recherc,Ministère de l'Enseignement supérieur et de la Recherche,France,96.0,Ministère de l'Enseignement supérieur et de la Recherche
105-ademe-direction-regionale-hauts-de-france,ademe-direction-regionale-hauts-de-france,Ademe - Direction régionale Hauts-de-France,Hauts-de-France,12.0,ADEME - Direction régionale
106-agence-de-leau-rhin-meuse,agence-de-leau-rhin-meuse,Agence de l'eau  Rhin-Meuse,Rhin-Meuse,19.0,Agence de l'eau
107-agence-de-leau-adour-garonne,agence-de-leau-adour-garonne,Agence de l'eau Adour-Garonne,Adour-Garonne,19.0,Agence de l'eau
108-agence-de-leau-artois-picardie,agence-de-leau-artois-picardie,Agence de l'eau Artois - Picardie,Artois-Picardie,19.0,Agence de l'eau
109-office-de-leau-reunion,office-de-leau-reunion,Office de l'eau Réunion,La Réunion,19.0,Agence de l'eau
110-office-de-leau-guyane,office-de-leau-guyane,Office de l'eau Guyane,,,
111-office-de-leau-guadeloupe,office-de-leau-guadeloupe,Office de l'eau Guadeloupe,Guadeloupe,19.0,Agence de l'eau
112-office-de-leau-martinique,office-de-leau-martinique,Office de l'eau Martinique,,,
113-banque-des-territoires,banque-des-territoires,Banque des Territoires,France,54.0,Banque des territoires (BdT)
114-ain-departement,ain-departement,Conseil départemental de l'Ain,,,
115-aisne-departement,aisne-departement,Conseil départemental de l'Aisne,Aisne,3.0,Conseil départemental (CD)
116-allier-departement,allier-departement,Conseil départemental de l'Allier,Allier,3.0,Conseil départemental (CD)
117-alpes-de-haute-provence-departement,alpes-de-haute-provence-departement,Conseil départemental des Alpes-de-Haute-Provence,Alpes-de-Haute-Provence,3.0,Conseil départemental (CD)
118-hautes-alpes-departement,hautes-alpes-departement,Conseil départemental des Hautes-Alpes,,,
119-alpes-maritimes-departement,alpes-maritimes-departement,Conseil départemental des Alpes-Maritimes,,,
120-ardeche-departement,ardeche-departement,Conseil départemental de l'Ardèche,Ardèche,3.0,Conseil départemental (CD)
121-ardennes-departement,ardennes-departement,Conseil départemental des Ardennes,Ardennes,3.0,Conseil départemental (CD)
123-aube-departement,aube-departement,Conseil départemental de l'Aube,Aube,3.0,Conseil départemental (CD)
124-aude-departement,aude-departement,Conseil départemental de l'Aude,Aude,3.0,Conseil départemental (CD)
125-aveyron-departement,aveyron-departement,Conseil départemental de l'Aveyron,Aveyron,3.0,Conseil départemental (CD)
126-bouches-du-rhone-departement,bouches-du-rhone-departement,Conseil départemental des Bouches-du-Rhône,Bouches-du-Rhône,3.0,Conseil départemental (CD)
127-calvados-departement,calvados-departement,Conseil départemental du Calvados,Calvados,3.0,Conseil départemental (CD)
128-cantal-departement,cantal-departement,Conseil départemental du Cantal,Cantal,3.0,Conseil départemental (CD)
129-charente-departement,charente-departement,Conseil départemental de la Charente,Charente,3.0,Conseil départemental (CD)
130-charente-maritime-departement,charente-maritime-departement,Conseil départemental de la Charente-Maritime,Charente-Maritime,,
131-cher-departement,cher-departement,Conseil départemental du Cher,,,
132-correze-departement,correze-departement,Conseil départemental de la Corrèze,Corrèze,3.0,Conseil départemental (CD)
133-cote-dor-departement,cote-dor-departement,Conseil départemental de la Côte-d'Or,Côte-d'Or,3.0,Conseil départemental (CD)
134-cotes-darmor-departement,cotes-darmor-departement,Conseil départemental des Côtes-d'Armor,,,
135-creuse-departement,creuse-departement,Conseil départemental de la Creuse,Creuse,3.0,Conseil départemental (CD)
136-dordogne-departement,dordogne-departement,Conseil départemental de la Dordogne,,,
137-doubs-departement,doubs-departement,Conseil départemental du Doubs,Doubs,3.0,Conseil départemental (CD)
138-drome-departement,drome-departement,Conseil départemental de la Drôme,Drôme,3.0,Conseil départemental (CD)
139-eure-departement,eure-departement,Conseil départemental de l'Eure,Eure,3.0,Conseil départemental (CD)
140-eure-et-loir-departement,eure-et-loir-departement,Conseil départemental d'Eure-et-Loir,Eure-et-Loir,3.0,Conseil départemental (CD)
141-finistere-departement,finistere-departement,Conseil départemental du Finistère,Finistère,3.0,Conseil départemental (CD)
142-corse-du-sud-departement,corse-du-sud-departement,Conseil départemental de la Corse-du-Sud,,,
143-haute-corse-departement,haute-corse-departement,Conseil départemental de la Haute-Corse,,,
144-gard-departement,gard-departement,Conseil départemental du Gard,Gard,3.0,Conseil départemental (CD)
145-haute-garonne-departement,haute-garonne-departement,Conseil départemental de la Haute-Garonne,,,
147-gironde-departement,gironde-departement,Conseil départemental de la Gironde,Gironde,3.0,Conseil départemental (CD)
148-herault-departement,herault-departement,Conseil départemental de l'Hérault,Hérault,3.0,Conseil départemental (CD)
149-ille-et-vilaine-departement,ille-et-vilaine-departement,Conseil départemental de l'Ille-et-Vilaine,Ille-et-Vilaine,3.0,Conseil départemental (CD)
150-indre-departement,indre-departement,Conseil départemental de l'Indre,,,
151-indre-et-loire-departement,indre-et-loire-departement,Conseil départemental d'Indre-et-Loire,Indre-et-Loire,3.0,Conseil départemental (CD)
152-isere-departement,isere-departement,Conseil départemental de l'Isère,Isère,3.0,Conseil départemental (CD)
153-jura-departement,jura-departement,Conseil départemental du Jura,,,
155-loir-et-cher-departement,loir-et-cher-departement,Conseil départemental du Loir-et-Cher,,,
156-loire-departement,loire-departement,Conseil départemental de la Loire,Loire,3.0,Conseil départemental (CD)
157-haute-loire-departement,haute-loire-departement,Conseil départemental de la Haute-Loire,Haute-Loire,3.0,Conseil départemental (CD)
158-loire-atlantique-departement,loire-atlantique-departement,Conseil départemental de la Loire-Atlantique,,,
159-loiret-departement,loiret-departement,Conseil départemental du Loiret,Loiret,3.0,Conseil départemental (CD)
161-lot-et-garonne-departement,lot-et-garonne-departement,Conseil départemental de Lot-et-Garonne,Lot-et-Garonne,3.0,Conseil départemental (CD)
162-lozere-departement,lozere-departement,Conseil départemental de la Lozère,Lozère,3.0,Conseil départemental (CD)
163-maine-et-loire-departement,maine-et-loire-departement,Conseil départemental du Maine-et-Loire,,,
164-manche-departement,manche-departement,Conseil départemental de la Manche,Manche,3.0,Conseil départemental (CD)
165-marne-departement,marne-departement,Conseil départemental de la Marne,Marne,3.0,Conseil départemental (CD)
166-haute-marne-departement,haute-marne-departement,Conseil départemental de la Haute-Marne,Haute-Marne,3.0,Conseil départemental (CD)
167-mayenne-departement,mayenne-departement,Conseil départemental de la Mayenne,,,
168-meurthe-et-moselle-departement,meurthe-et-moselle-departement,Conseil départemental de Meurthe-et-Moselle,Meurthe-et-Moselle,3.0,Conseil départemental (CD)
170-morbihan-departement,morbihan-departement,Conseil départemental du Morbihan,Morbihan,3.0,Conseil départemental (CD)
171-moselle-departement,moselle-departement,Conseil départemental de la Moselle,Moselle,3.0,Conseil départemental (CD)
172-nievre-departement,nievre-departement,Conseil départemental de la Nièvre,Nièvre,3.0,Conseil départemental (CD)
173-nord-departement,nord-departement,Conseil départemental du Nord,Nord,3.0,Conseil départemental (CD)
174-oise-departement,oise-departement,Conseil départemental de l'Oise,Oise,3.0,Conseil départemental (CD)
175-orne-departement,orne-departement,Conseil départemental de l'Orne,Orne,3.0,Conseil départemental (CD)
176-pas-de-calais-departement,pas-de-calais-departement,Conseil départemental du Pas-de-Calais,,,
177-puy-de-dome-departement,puy-de-dome-departement,Conseil départemental du Puy-de-Dôme,Puy-de-Dôme,3.0,Conseil départemental (CD)
178-pyrenees-atlantiques-departement,pyrenees-atlantiques-departement,Conseil départemental des Pyrénées-Atlantiques,,,
179-hautes-pyrenees-departement,hautes-pyrenees-departement,Conseil départemental des Hautes-Pyrénées,Hautes-Pyrénées,3.0,Conseil départemental (CD)
180-pyrenees-orientales-departement,pyrenees-orientales-departement,Conseil départemental des Pyrénées-Orientales,,,
181-bas-rhin-departement,bas-rhin-departement,Conseil départemental du Bas-Rhin,,,
182-haut-rhin-departement,haut-rhin-departement,Conseil départemental du Haut-Rhin,,,
183-rhone-departement,rhone-departement,Conseil départemental du Rhône,Rhône,3.0,Conseil départemental (CD)
184-haute-saone-departement,haute-saone-departement,Conseil départemental de la Haute-Saône,,,
185-saone-et-loire-departement,saone-et-loire-departement,Conseil départemental de Saône-et-Loire,Saône-et-Loire,3.0,Conseil départemental (CD)
186-sarthe-departement,sarthe-departement,Conseil départemental de la Sarthe,,,
187-departemental-de-la-savoie,departemental-de-la-savoie,Départemental de la Savoie,Savoie,,
188-haute-savoie-departement,haute-savoie-departement,Conseil départemental de la Haute-Savoie,Haute-Savoie,3.0,Conseil départemental (CD)
189-paris-departement,paris-departement,Conseil de Paris,Paris,112.0,Commune
190-seine-maritime-departement,seine-maritime-departement,Conseil départemental de la Seine-Maritime,Seine-Maritime,3.0,Conseil départemental (CD)
191-seine-et-marne-departement,seine-et-marne-departement,Conseil départemental de la Seine-et-Marne,Seine-et-Marne,3.0,Conseil départemental (CD)
192-yvelines-departement,yvelines-departement,Conseil départemental des Yvelines,Yvelines,3.0,Conseil départemental (CD)
193-deux-sevres-departement,deux-sevres-departement,Conseil départemental des Deux-Sèvres,,,
194-somme-departement,somme-departement,Conseil départemental de la Somme,Somme,3.0,Conseil départemental (CD)
196-tarn-et-garonne-departement,tarn-et-garonne-departement,Conseil départemental du Tarn-et-Garonne,Tarn-et-Garonne,3.0,Conseil départemental (CD)
197-var-departement,var-departement,Conseil départemental du Var,,,
198-vaucluse-departement,vaucluse-departement,Conseil départemental du Vaucluse,Vaucluse,3.0,Conseil départemental (CD)
199-vendee-departement,vendee-departement,Conseil départemental de la Vendée,Vendée,3.0,Conseil départemental (CD)
200-vienne-departement,vienne-departement,Conseil départemental de la Vienne,Vienne,3.0,Conseil départemental (CD)
201-haute-vienne-departement,haute-vienne-departement,Conseil départemental de la Haute-Vienne,Haute-Vienne,3.0,Conseil départemental (CD)
202-vosges-departement,vosges-departement,Conseil départemental des Vosges,,,
203-yonne-departement,yonne-departement,Conseil départemental de l'Yonne,Yonne,3.0,Conseil départemental (CD)
204-territoire-de-belfort-departement,territoire-de-belfort-departement,Conseil départemental du Territoire de Belfort,,,
206-hauts-de-seine-departement,hauts-de-seine-departement,Conseil départemental des Hauts-de-Seine,Hauts-de-Seine,3.0,Conseil départemental (CD)
207-seine-saint-denis-departement,seine-saint-denis-departement,Conseil départemental de la Seine-Saint-Denis,Seine-Saint-Denis,3.0,Conseil départemental (CD)
208-val-de-marne-departement,val-de-marne-departement,Conseil départemental du Val-de-Marne,Val-de-Marne,3.0,Conseil départemental (CD)
209-val-doise-departement,val-doise-departement,Conseil départemental du Val-d'Oise,Val-d'Oise,3.0,Conseil départemental (CD)
210-guadeloupe-departement,guadeloupe-departement,Conseil départemental de la Guadeloupe,Guadeloupe,3.0,Conseil départemental (CD)
213-la-reunion-departement,la-reunion-departement,Conseil départemental de La Réunion,La Réunion,3.0,Conseil départemental (CD)
214-mayotte-departement,mayotte-departement,Conseil départemental de Mayotte,Mayotte,3.0,Conseil départemental (CD)
215-ademe-direction-regionale-ile-de-france,ademe-direction-regionale-ile-de-france,Ademe — Direction régionale — Île-de-France,Île-de-France,12.0,ADEME - Direction régionale
216-banque-des-territoires-direction-regionale-ile-de-,banque-des-territoires-direction-regionale-ile-de-,Banque des Territoires — Direction régionale — Île-de-France,Île-de-France,,
217-prefecture-de-region-ile-de-france,prefecture-de-region-ile-de-france,Préfecture de région — Île-de-France,Île-de-France,39.0,Préfecture de région
218-direction-regionale-de-lalimentation-de-lagricultu,direction-regionale-de-lalimentation-de-lagricultu,"Direction régionale de l'Alimentation, de l'Agriculture et de la Forêt (DRAAF) — Île-de-France",,,
219-direction-regionale-des-affaires-culturelles-drac-,direction-regionale-des-affaires-culturelles-drac-,Direction régionale des Affaires culturelles (DRAC) — Île-de-France,Île-de-France,32.0,Direction régionale des Affaires culturelles (DRAC)
220-direction-regionale-de-leconomie-de-lemploi-du-tra,direction-regionale-de-leconomie-de-lemploi-du-tra,"Direction régionale de l’Economie, de l’Emploi, du Travail et des Solidarités (DREETS) — Île-de-France",Île-de-France,29.0,"Direction régionale de l’Economie, de l’Emploi, du Travail et des Solidarités (DREETS)"
221-direction-regionale-de-lenvironnement-de-lamenagem,direction-regionale-de-lenvironnement-de-lamenagem,"Direction régionale de l’environnement, de l’aménagement et du logement (DREAL) — Île-de-France",Île-de-France,30.0,"Directions régionales de l’environnement, de l’aménagement et du logement (DEAL / DREAL / DRIEAT)"
222-direction-regionale-des-finances-publiques-drfip-i,direction-regionale-des-finances-publiques-drfip-i,Direction régionale des Finances publiques (DRFiP) — Île-de-France,,,
223-region-academique-ile-de-france,region-academique-ile-de-france,Région académique — Île-de-France,Île-de-France,95.0,Ministère de l'Éducation nationale et de la Jeunesse
224-direction-regionale-de-la-jeunesse-des-sports-et-d,direction-regionale-de-la-jeunesse-des-sports-et-d,"Direction régionale de la Jeunesse, des Sports et de la Cohésion sociale (DRJSCS) — Île-de-France",,,
225-delegation-regionale-a-la-recherche-et-a-la-techno,delegation-regionale-a-la-recherche-et-a-la-techno,Délégation régionale à la recherche et à la technologie (DRRT) — Île-de-France,,,
226-agence-regionale-de-sante-ars-ile-de-france,agence-regionale-de-sante-ars-ile-de-france,Agence régionale de santé (ARS) — Île-de-France,Île-de-France,16.0,Agence régionale de santé (ARS)
227-ademe-direction-regionale-centre-val-de-loire,ademe-direction-regionale-centre-val-de-loire,Ademe — Direction régionale — Centre-Val de Loire,,12.0,ADEME - Direction régionale
228-banque-des-territoires-direction-regionale-centre-,banque-des-territoires-direction-regionale-centre-,Banque des Territoires — Direction régionale — Centre-Val de Loire,,,
229-prefecture-de-region-centre-val-de-loire,prefecture-de-region-centre-val-de-loire,Préfecture de région — Centre-Val de Loire,Centre-Val de Loire,39.0,Préfecture de région
230-direction-regionale-de-lalimentation-de-lagricultu,direction-regionale-de-lalimentation-de-lagricultu,"Direction régionale de l'Alimentation, de l'Agriculture et de la Forêt (DRAAF) — Centre-Val de Loire",,,
231-direction-regionale-des-affaires-culturelles-drac-,direction-regionale-des-affaires-culturelles-drac-,Direction régionale des Affaires culturelles (DRAC) — Centre-Val de Loire,Centre-Val de Loire,32.0,Direction régionale des Affaires culturelles (DRAC)
232-direction-regionale-de-leconomie-de-lemploi-du-tra,direction-regionale-de-leconomie-de-lemploi-du-tra,"Direction régionale de l’Economie, de l’Emploi, du Travail et des Solidarités (DREETS) — Centre-Val de Loire",Centre-Val de Loire,29.0,"Direction régionale de l’Economie, de l’Emploi, du Travail et des Solidarités (DREETS)"
233-direction-regionale-de-lenvironnement-de-lamenagem,direction-regionale-de-lenvironnement-de-lamenagem,"Direction régionale de l’environnement, de l’aménagement et du logement (DREAL) — Centre-Val de Loire",Centre-Val de Loire,30.0,"Directions régionales de l’environnement, de l’aménagement et du logement (DEAL / DREAL / DRIEAT)"
234-direction-regionale-des-finances-publiques-drfip-c,direction-regionale-des-finances-publiques-drfip-c,Direction régionale des Finances publiques (DRFiP) — Centre-Val de Loire,,,
235-region-academique-centre-val-de-loire,region-academique-centre-val-de-loire,Région académique — Centre-Val de Loire,,,
236-direction-regionale-de-la-jeunesse-des-sports-et-d,direction-regionale-de-la-jeunesse-des-sports-et-d,"Direction régionale de la Jeunesse, des Sports et de la Cohésion sociale (DRJSCS) — Centre-Val de Loire",,,
237-delegation-regionale-a-la-recherche-et-a-la-techno,delegation-regionale-a-la-recherche-et-a-la-techno,Délégation régionale à la recherche et à la technologie (DRRT) — Centre-Val de Loire,,,
238-agence-regionale-de-sante-ars-centre-val-de-loire,agence-regionale-de-sante-ars-centre-val-de-loire,Agence régionale de santé (ARS) — Centre-Val de Loire,,,
239-ademe-direction-regionale-bourgogne-franche-comte,ademe-direction-regionale-bourgogne-franche-comte,Ademe — Direction régionale — Bourgogne-Franche-Comté,Bourgogne-Franche-Comté,12.0,ADEME - Direction régionale
240-banque-des-territoires-direction-regionale-bourgog,banque-des-territoires-direction-regionale-bourgog,Banque des Territoires — Direction régionale — Bourgogne-Franche-Comté,,,
241-prefecture-de-region-bourgogne-franche-comte,prefecture-de-region-bourgogne-franche-comte,Préfecture de région — Bourgogne-Franche-Comté,Bourgogne-Franche-Comté,39.0,Préfecture de région
242-direction-regionale-de-lalimentation-de-lagricultu,direction-regionale-de-lalimentation-de-lagricultu,"Direction régionale de l'Alimentation, de l'Agriculture et de la Forêt (DRAAF) — Bourgogne-Franche-Comté",,28.0,"Direction régionale de l'Alimentation, de l'Agriculture et de la Forêt (DRAAF)"
243-direction-regionale-des-affaires-culturelles-drac-,direction-regionale-des-affaires-culturelles-drac-,Direction régionale des Affaires culturelles (DRAC) — Bourgogne-Franche-Comté,Bourgogne-Franche-Comté,32.0,Direction régionale des Affaires culturelles (DRAC)
244-direction-regionale-leconomie-de-lemploi-du-travai,direction-regionale-leconomie-de-lemploi-du-travai,"Direction régionale l’Economie, de l’Emploi, du Travail et des Solidarités (DREETS) — Bourgogne-Franche-Comté",,29.0,"Direction régionale de l’Economie, de l’Emploi, du Travail et des Solidarités (DREETS)"
245-direction-regionale-de-lenvironnement-de-lamenagem,direction-regionale-de-lenvironnement-de-lamenagem,"Direction régionale de l’environnement, de l’aménagement et du logement (DREAL) — Bourgogne-Franche-Comté",Bourgogne-Franche-Comté,30.0,"Directions régionales de l’environnement, de l’aménagement et du logement (DEAL / DREAL / DRIEAT)"
